generic,exemplar
Largemouth bass eats fish.,Largemouth bass eats small fish.
Largemouth bass eats fish.,Largemouth bass eats other smaller fish.
Largemouth bass eats fish.,Largemouth bass eats other aquatic animals.
Largemouth bass eats fish.,Largemouth bass eats fish.
Fish can collect zinc in their bodies if they live in water containing zinc.,Fish that live in water containing zinc is able to absorb zinc from their environment.
Fish can collect zinc in their bodies if they live in water containing zinc.,Fish that live in water containing zinc is able to store zinc in their tissue.
Salmonellas enter bloodstreams.,Salmonellas enter a bloodstream.
Salmonellas enter bloodstreams.,Salmonellas enter blood.
Cichlids require.,Cichlids are able to require a certain water temperature.
Cichlids require.,Cichlids are able to require a certain water hardness.
Cichlids require.,Cichlids are able to require a certain water quality.
Cichlids require.,Cichlids are able to require a certain water ph.
Jellyfish have nerve rings.,Jellyfish have a nerve ring.
Fish prey on larvae.,Fish prey on crustacean larvae.
Fish prey on larvae.,Fish prey on mollusk larvae.
Fish contain various toxins.,Fish contain dioxins.
Sharks prey on great hammerheads.,Sharks prey on great hammerheads.
Garter snakes feed on fish.,Garter snakes feed on small fish.
Garter snakes feed on fish.,Garter snakes feed on fish.
Fish larvae have eyes.,A fish larvae have a retina.
Salmon sharks maintain body temperature.,Salmon sharks maintain an aerobic body temperature.
Fishes live in rivers and lakes.,Fishes live in freshwater rivers and lakes.
Fishes live in rivers and lakes.,Fishes live in freshwater lakes.
Starfishs retract stomachs.,Starfishs retract the stomachs of starfishs can retract into their bodies.
Starfishs retract stomachs.,Starfishs retract the stomach.
Starfishs retract stomachs.,Starfishs retract an internal stomach.
Fish have pharynxs.,Fish have a pharynx.
Fish use their dorsal fins to swim.,Fish use a dorsal fin.
Fish use their dorsal fins to swim.,Fish use some fish use their dorsal fins to swim.
Carbohydrate sugar consists of fructose.,A carbohydrate sugar consists of a fructose.
Salmonellas are located in turtles.,Salmonellas are located in softshell turtles.
Salmonellas are located in turtles.,Salmonellas are located in water turtles.
Salmonellas are located in turtles.,Salmonellas are located in turtles.
Fish produce enzymes.,Fish produce proteases (breakdown proteins).
Freshwater fish contain mercury.,Freshwater fish contain organic mercury.
Starfishs prey on clams.,Starfishs prey on smaller clams.
Lungfish possess single fins.,Lungfish possess a single dorsal fin.
Lungfish live for several years.,Lungfish live for several years in the wild.
Lungfish live for several years.,Lungfish live for several years.
Fish scales are part of largemouths.,Fish scales are part of a largemouth bass.
Shellfish poison is caused by shellfish.,A shellfish poison is caused by shellfish toxins.
Sharks only eat fish.,Sharks eat other marine animals.
Sharks only eat fish.,Sharks eat fish.
Sharks only eat fish.,Sharks eat large fish.
Jellyfish develop organs.,Jellyfish develop a digestive system.
Lampreys attain maturity.,Lampreys attain a physical maturity.
Lampreys attain maturity.,Lampreys attain a maturation.
Sharks even eat swordfish.,Sharks eat swordfish.
Eels eat dead fish.,Eels eat a dead fish.
Fish eat parasites.,Fish eat nematodes.
Sharks live in reefs.,Sharks live in coral reefs.
Sharks live in reefs.,Sharks live in rocky reefs.
Marine eels eat fish.,Marine eels eat other fish.
Marine eels eat fish.,Marine eels eat small fish.
Sharks can replace their front teeth every two weeks.,Sharks are able to replace their front teeth every two weeks.
Sharks can replace their front teeth every two weeks.,Sharks are able to replace their front teeth every few weeks.
Fish are eaten by predators.,Fish are eaten by larger fish.
Whale sharks feed on plankton.,Whale sharks feed on zooplankton.
Whale sharks feed on plankton.,Whale sharks feed on plankton.
Jellyfish live in reefs.,Jellyfish live in coral reefs.
Jellyfish live in reefs.,Jellyfish live in tropical reefs.
Early tetrapods live in lagoons.,Early tetrapods live in artificial lagoons.
Sharks eat turtles.,Sharks eat softshell turtles.
Sharks eat turtles.,Sharks eat sea turtles.
Peels are part of pomegranates.,Peels are part of pomegranates.
Bony fish lay eggs that drift through the water column.,Bony fish lay eggs that drift through the water column.
Bony fish lay eggs that drift through the water column.,Bony fish lay fish eggs.
Fish contain various environmental toxins.,Fish contain dioxins.
Large sharks eat mammals.,Large sharks eat manatees.
Female kangaroos carry babies.,Female kangaroos carry a fetus that is developing inside the female's body.
Female kangaroos carry babies.,Female kangaroos carry joeys (babies).
Female kangaroos carry babies.,Female kangaroos carry their live young (joeys).
Female kangaroos carry babies.,Female kangaroos carry fetuses.
Female kangaroos carry babies.,Female kangaroos carry pregnancies.
Sea lampreys have fins.,Sea lampreys have a dorsal fin.
Fish scales are part of anglerfish.,Fish scales are part of an anglerfish.
Fish are hermaphrodites.,Fish are a hermaphrodite.
Fish are hermaphrodites.,Fish are hermaphrodites are fish that can change sex.
Fish live in coasts.,Fish live in nearshore areas.
Tetrahymena possesses cilia.,A Tetrahymena possesses cilium-like organelles.
Tetrahymena possesses cilia.,A tetrahymena possesses a ciliary band.
Heels are part of shoes.,Heels are part of women's shoes.
Heels are part of shoes.,Heels are part of heeled shoes.
Heels are part of shoes.,Heels are part of high heels.
Fish scales are part of fish.,Fish scales are part of fish scales are part of the fish's skin.
Fish scales are part of fish.,Fish scales are part of fish scales are part of the scales of fish.
Hagfish live on bottoms.,Hagfish live on bottoms of the sea.
Fish scales are part of flounder.,Fish scales are part of a flounder.
Fish possess lungs.,Fish possess air sacs.
Fish possess lungs.,Fish possess air bladders.
Krill live in oceans.,A krill live in an open ocean.
Garter snakes eat bullfrog tadpoles.,Garter snakes eat bullfrog tadpoles.
Species of sharks lay eggs with the developing embryo covered by a tough.,Species of sharks lay a fertilized eggs with a tough membrane.
Species of sharks lay eggs with the developing embryo covered by a tough.,Species of sharks lay an embryonic eggs with a tough membrane.
Species of sharks lay eggs with the developing embryo covered by a tough.,Species of sharks lay a developing embryos with a tough membrane.
Female mosquitofishs reach maturity.,Female mosquitofishs reach a maturation.
Catfish eat fish.,Catfish eat other fish.
Catfish eat fish.,Catfish eat small fish.
Catfish eat fish.,Catfish eat fish.
Hagfish live in mud.,Hagfish live in a marine mud.
Barbary sheep live in snow.,Barbary sheep live in winter.
Lungfish possess lungs.,Lungfish possess a lungs that are used for gas exchange.
Lungfish possess lungs.,Lungfish possess one pair of lungs.
Bluefish kill prey.,Bluefish kill crustaceans.
Bluefish kill prey.,Bluefish kill a small fish.
Sharks feed on turtles.,Sharks feed on turtles that live in the ocean.
Sharks feed on turtles.,Sharks feed on sea turtles.
Sharks feed on turtles.,Sharks feed on softshell turtles.
Sharks feed on turtles.,Sharks feed on turtle meat.
Freshwater fish feed on freshwater snails.,Freshwater fish feed on native freshwater snails.
Fish eat insects.,Fish eat invertebrates.
Fish eat insects.,Fish eat crickets.
Fish eat insects.,Fish eat insects.
Sponges have symbiotic algae and can bleach like corals.,Sponges have symbiotic algae can bleach like corals.
Garden snails hibernate during winter.,Garden snails hibernate during most garden snails hibernate during the winter months.
Garden snails hibernate during winter.,Garden snails hibernate during a northern hemisphere.
Sharks are oviparous .,"Sharks are there are oviparous shark species, which lay eggs."
Large sharks have few natural predators.,Large sharks have few natural predators.
Large sharks have few natural predators.,Large sharks have lack of natural predators.
Carpels contain seeds.,Carpels contain seeds.
Stonefishs kill prey.,Stonefishs kill crustaceans.
Stonefishs kill prey.,Stonefishs kill a small fish.
Stonefishs kill prey.,Stonefishs kill a fish.
Stonefishs kill prey.,Stonefishs kill another fish.
Bluefish have point snouts.,Bluefish have an others have a very pointed snout.
Marine sponges produce buds.,Marine sponges produce regenerative buds.
Fish eat larval shrimp.,Fish eat larvae of freshwater shrimp.
Fish scales are part of goldfish.,Fish scales are part of scales of a fish.
Fish scales are part of goldfish.,Fish scales are part of a goldfish.
Sharks prey on bottlenose dolphins.,Sharks prey on bottlenose dolphins.
Fish contain oxygen.,Fish contain dissolved oxygen in muscle.
Fish contain oxygen.,Fish contain dissolved oxygen.
Electric eels produce voltage.,Electric eels produce kilo volts.
Electric eels produce voltage.,Electric eels produce volts.
Trouts eat insects.,Trouts eat crickets.
Trouts eat insects.,Trouts eat insects.
Krill live in southern oceans.,A krill live in a southern ocean.
Fish swim in ponds.,Fish swim in man-made ponds.
Garden pests excrete sticky substances.,Garden pests excrete a sticky goo.
Sharks eat stingrays.,Sharks eat stingrays.
Sharks eat stingrays.,Sharks eat small stingrays.
Glass catfish eat fish.,Glass catfish eat small fish.
Glass catfish eat fish.,Glass catfish eat live food.
Fish possess genes.,Fish possess a genes that control the development of the fish.
Sharks range in size.,Sharks range in girth.
Sharks range in size.,Sharks range in weight.
Sharks have testes.,Sharks have a testes in the body cavity.
Tiger sharks eat turtles.,Tiger sharks eat sea turtles.
Tiger sharks eat turtles.,Tiger sharks eat tropical sea turtles.
Garter snakes eat amphibians.,Garter snakes eat european toads.
American lungfish possess fins.,American lungfish possess dorsal fins.
American lungfish possess lungs.,American lungfish possess air sacs.
American lungfish possess lungs.,American lungfish possess alveoli.
Tiger sharks feed on turtles.,Tiger sharks feed on turtles that live in the ocean.
Bull sharks eat sharks.,Bull sharks eat other sharks.
Fish develop lungs.,Fish develop air sacs.
Hagfish eat fish.,Hagfish eat small fish.
Cigarette smoke induces atherosclerosis.,A cigarette smoke induces atherosclerosis of the coronary arteries.
Cigarette smoke induces atherosclerosis.,A Cigarette smoke induces atherosclerosis of the peripheral arteries.
Cigarette smoke induces atherosclerosis.,A Cigarette smoke induces atherosclerosis of the cerebral arteries.
Cigarette smoke induces atherosclerosis.,"A cigarette smoke induces a cigarette smoking induces fatty streak, plaque, and stenosis atherosclerosis."
Cigarette smoke induces atherosclerosis.,A Cigarette smoke induces narrowing of the arteries.
Hagfish have ovaries.,Hagfish have ovarian follicles.
Hagfish have ovaries.,Hagfish have oocytes.
Jellyfish have guts.,Jellyfish have a digestive system.
White sharks eat dolphins.,White sharks eat white sharks can eat small to medium-sized dolphins.
White sharks eat dolphins.,White sharks eat small to medium-sized dolphins.
Guppies eat insects.,Guppies eat gnats.
Cougars kill coyotes.,Cougars kill coyotes.
Sea slugs produce up to a million eggs.,Sea slugs produce up to a million eggs.
Garter snakes eat tadpoles.,Garter snakes eat tadpoles of any kind.
Snakes do have traces of hind limbs.,Snakes do have vestigial hind limbs.
Vipers eat mice.,"Vipers eat small mammals, such as mice."
Vipers eat mice.,Vipers eat voles.
Geckos have movable eyelids.,Geckos have movable eyelids.
Geckos have movable eyelids.,Geckos have eyelid muscles.
Lizards emerge from caves.,Lizards emerge from crevices.
Iguanas feed on algas.,Iguanas feed on green algae.
Lizards seize prey.,Lizards seize arthropods.
Lizards seize prey.,Lizards seize small mammals.
Sea turtles leave oceans.,Sea turtles leave the atlantic ocean.
Lizards sit in trees.,Lizards sit in tree branches.
Lizards do protect their eggs from predators.,Lizards do protect some lizards protect their eggs by guarding them.
Snakes have smooth scales on their back and keeled scales on another part of their body .,Snakes have smooth scales on their back.
Hellbenders live in freshwater streams.,Hellbenders live in rivers and streams.
Hellbenders live in freshwater streams.,Hellbenders live in rivers.
Hellbenders live in freshwater streams.,Hellbenders live in small streams.
Hellbenders live in freshwater streams.,Hellbenders live in streams.
Hellbenders live in freshwater streams.,Hellbenders live in large streams.
Sea turtles live in oceans.,Sea turtles live in atlantic.
Crocodiles eat bull sharks.,Crocodiles eat bull sharks.
Crocodiles eat bull sharks.,Crocodiles eat oceanic bull sharks.
Snakes are capable of detecting body heat of prey items.,Snakes are capable of detecting body heat of prey items from a distance.
Snakes are capable of detecting body heat of prey items.,Snakes are capable of external detecting body heat of prey items.
Snakes are capable of detecting body heat of prey items.,Snakes are capable of internal detecting body heat of prey items.
Snakes feed on birds.,Snakes feed on small birds.
Sea turtles feed on jelly.,Sea turtles feed on jellyfish.
Snakes capture animals.,Snakes capture other small animals.
Snakes occur in tropical areas.,Snakes occur in subtropical areas.
Leopard geckos emerge at nights.,Leopard geckos emerge at night.
Leopard geckos emerge at nights.,Leopard geckos emerge at dusk.
Leopard geckos emerge at nights.,Leopard geckos emerge at the night.
Leopard geckos emerge at nights.,Leopard geckos emerge at a late evening.
Leopard geckos emerge at nights.,Leopard geckos emerge at cool nights.
Vipers reach maturity.,Vipers reach a maturation of venom gland.
Snakes live in forests.,Snakes live in a rainforest.
Wood turtles live to ages.,Wood turtles live to adults.
Snakes eat banana slugs.,Snakes eat giant banana slugs.
Snakes eat banana slugs.,Snakes eat small banana slugs.
Lizards inhabit bushes.,Lizards inhabit bushy shrubs.
Lizards inhabit bushes.,Lizards inhabit a shrub.
Lizards inhabit bushes.,Lizards inhabit a bush.
Tortoises engage in mate behavior.,Tortoises engage in courtship behavior.
Tortoises engage in mate behavior.,Tortoises engage in courtship.
Tortoises engage in mate behavior.,Tortoises engage in mating behavior.
Tortoises engage in mate behavior.,Tortoises engage in mating.
Snakes hide in burrows.,Snakes hide in holes in the ground.
Crocodiles rest on sand.,Crocodiles rest on a beach.
Crocodiles rest on sand.,Crocodiles rest on dry sand.
Crocodiles rest on sand.,Crocodiles rest on a beach sand.
Armadillo lizards attain maturity.,Armadillo lizards attain a growth maturity.
Sea turtles rely on light.,Sea turtles rely on reflective light from the sun.
Snakes feed on mice.,Snakes feed on small mammals such as mice and voles.
Lizards have adhesive pads.,Lizards have adhesive foot pads.
Poisonous snakes have special fangs for injecting their venom.,Poisonous snakes have fangs for injecting venom.
Lizards live in holes.,Lizards live in holes in the ground.
Lizards live in holes.,Lizards live in a hole in the ground.
Lizards live in holes.,Lizards live in burrows.
Snakes live in deserts.,Snakes live in arid deserts.
Snakes live in deserts.,Snakes live in semiarid deserts.
Lizards sit on branches.,Lizards sit on a tree.
Lizards sit on branches.,Lizards sit on tree branches.
Iguanas eat rabbit pellets.,Iguanas eat small animal feed pellets.
Lizards come out at day and at night and all day.,Lizards come out during the day and at night.
Lizards come out at day and at night and all day.,Lizards come out during the day.
Lizards come out at day and at night and all day.,Lizards come lizards come out during the day and night.
Gopher tortoises eat grass.,Gopher tortoises eat wild grasses.
Snakes eat amphibians.,"Snakes eat amphibians (frogs, toads, salamanders)."
Snakes eat amphibians.,"Snakes eat frogs, toads, fish, lizards, salamanders."
Snakes eat amphibians.,Snakes eat frogs.
Snakes make venom.,Snakes make a neurotoxic venom.
Crocodiles kill humans.,Crocodiles kill a human -man -woman -boy -girl.
Crocodiles kill humans.,Crocodiles kill human beings.
Green anoles die of dehydration.,Green anoles die of dehydration.
Lizards eat fruit.,Lizards eat fruit.
Snakes absorb calcium.,Snakes absorb calcium from other animals.
Diurnal lizards have eyesights.,Diurnal lizards have diurnal lizards have good eyesights.
Diurnal lizards have eyesights.,Diurnal lizards have normal eyesight.
Diurnal lizards have eyesights.,Diurnal lizards have day-vision.
Lizards can grow a new tail.,Lizards are able to regrow a lost tail.
Lizards can grow a new tail.,Lizards are able to regenerate a lost tail.
Lizards can grow a new tail.,Lizards are able to grow a new tail.
Sea turtles reach maturity.,Sea turtles reach a maturation.
Lizards thrive in landscapes.,Lizards thrive in grassy areas.
Crocodiles reach sexual maturity.,Crocodiles reach sexual maturity.
Sea turtles dig holes.,Sea turtles dig a foraging hole.
Sea turtles dig holes.,Sea turtles dig burrows.
Sea turtles dig holes.,Sea turtles dig a nesting hole.
Sea turtles dig holes.,Sea turtles dig nesting cavities.
Sea turtles dig holes.,Sea turtles dig a resting hole.
Snakes thrive in deserts.,Snakes thrive in arid deserts.
Greek tortoises grow into healthy adults.,Greek tortoises grow into an adult.
Snakes seek mates.,Snakes seek mates for breeding purposes.
Snakes seek mates.,Snakes seek mates to breed.
Snakes seek mates.,Snakes seek a mates for breeding.
Snakes seek mates.,Snakes seek mating partners.
Lizards emerge from holes.,Lizards emerge from holes in the ground.
Lizards emerge from holes.,Lizards emerge from rock crevices.
Lizards emerge from holes.,Lizards emerge from crevices in rocks.
Lizards emerge from holes.,Lizards emerge from burrows.
Lizards emerge from holes.,Lizards emerge from abandoned animal burrows.
Snakes eat small lizards.,Snakes eat lizards.
Snakes live in woodlands.,Snakes live in coniferous forests.
Snakes live in woodlands.,Snakes live in moist woodlands.
Ball pythons reach reproductive maturity.,"Ball pythons reach sexual maturity, reproductive maturity, and breeding age."
Ball pythons reach reproductive maturity.,Ball pythons reach sexual maturity-reproductive maturity.
Ball pythons reach reproductive maturity.,Ball pythons reach a breeding age.
Wood turtles reach maturity.,Wood turtles reach a maturation in size.
Wood turtles reach maturity.,Wood turtles reach a physiological maturity.
Iguanas eat leaves.,Iguanas eat broad-leaved plants.
Iguanas eat leaves.,Iguanas eat evergreen leaves.
Iguanas eat leaves.,Iguanas eat fleshy leaves.
Iguanas eat leaves.,Iguanas eat vegetable leaves.
Sea turtles eat grass.,Sea turtles eat marine grasses.
Lizards live in australia.,Lizards live in the australian bush.
Crocodiles possess eggs.,Crocodiles possess fertilized eggs.
Crocodiles possess eggs.,Crocodiles possess eggs of other reptiles.
Crocodiles possess eggs.,Crocodiles possess reptile eggs.
Crocodiles possess eggs.,Crocodiles possess eggs.
Crocodiles possess eggs.,Crocodiles possess developing eggs.
Crocodiles live in lakes.,Crocodiles live in saltwater lakes.
Crocodiles live in lakes.,Crocodiles live in freshwater lakes.
Crocodiles live in lakes.,Crocodiles live in freshwater.
Snakes use tongues.,Snakes use tongue flicking.
Tortoises eat insects.,Tortoises eat arthropods.
Tortoises eat insects.,Tortoises eat bugs.
Tortoises eat insects.,Tortoises eat beetles.
Crocodiles live in saltwaters.,Crocodiles live in estuaries.
Crocodiles live in saltwaters.,Crocodiles live in coastal saltwaters.
Snakes eat bullfrogs.,Snakes eat bullfrogs are a common prey for snakes.
Snakes eat bullfrogs.,Snakes eat bullfrogs.
Gopher tortoises engage in mate behavior.,Gopher tortoises engage in courtship behavior.
Gopher tortoises engage in mate behavior.,Gopher tortoises engage in mating behavior.
Gopher tortoises engage in mate behavior.,Gopher tortoises engage in courtship.
Gopher tortoises engage in mate behavior.,Gopher tortoises engage in mating.
Geckos live in rainforests.,Geckos live in a tropical rainforest.
Crocodiles lose teeth.,Crocodiles lose canines.
Crocodiles lose teeth.,Crocodiles lose molars.
Snakes thrive in forests.,Snakes thrive in a forest with a lot of trees.
Spectacle caimen eat aquatic insects.,Spectacle caimen eat an aquatic beetle.
Iguanas eat pellets.,Iguanas eat a pellet food.
Crocodiles come from nests.,Crocodiles come from a nest.
Vipers have receptors.,Vipers have nociceptors.
Tortoises die of diseases.,Tortoises die of parasites.
Wasp larvae feed on tarantulas.,A wasp larvae feed on tarantula spiders.
Wasp larvae feed on tarantulas.,A wasp larvae feed on tarantulas.
Lizards attain maturity.,Lizards attain a physical maturity.
Lizards have pads.,Lizards have foot pads.
American alligators dig burrows.,American alligators dig hiding places.
Desert tortoises eat insects.,Desert tortoises eat invertebrates.
Desert tortoises eat insects.,Desert tortoises eat bugs.
Desert tortoises eat insects.,Desert tortoises eat beetles.
Tortoises reach maturity.,Tortoises reach a physical maturity.
Tortoises reach maturity.,Tortoises reach maturation of their shells.
Tortoises reach maturity.,Tortoises reach physiological maturity.
Tortoises reach maturity.,Tortoises reach a growth maturity.
Wood turtles reach sexual maturity.,Wood turtles reach sexual maturity as adults.
Jerboas reside in burrows.,Jerboas reside in burrows in the ground.
Crocodiles eat chickens.,Crocodiles eat a domestic chicken.
Lizards eat lizards.,Lizards eat other lizards.
Snakes eat worms.,Snakes eat earthworms.
Lizards display limbs.,Lizards display forelimbs.
Lizards display limbs.,Lizards display lizard limbs.
Lizards display limbs.,Lizards display arms.
Snakes feed on fish.,Snakes feed on aquatic invertebrates.
Snakes feed on fish.,Snakes feed on fish.
Crocodiles are more aggressive than alligators.,Crocodiles are more aggressive than crocodiles are more aggressive than alligators.
Lizards rub up against trees or rocks to scrape off patches of their molting skin.,Lizards rub to scrape patches of molting skin.
Geckos eat crickets.,Geckos eat crickets.
Lizards change colors very quickly to match their environment.,Lizards change to change colors to match their environment.
Lizards hide in crevices.,Lizards hide in rock crevices.
Lizards hide in crevices.,Lizards hide in cracks in rocks.
Lizards hide in crevices.,Lizards hide in under rocks.
Snakes feed on frogs.,Snakes feed on frogs.
Desert tortoises emerge from burrows.,Desert tortoises emerge from holes in the ground.
Desert tortoises emerge from burrows.,Desert tortoises emerge from burrows in the ground.
Desert tortoises emerge from burrows.,Desert tortoises emerge from in a hole in the ground.
Tortoises emerge from burrows.,Tortoises emerge from burrows in the ground.
Lizards prefer light.,Lizards prefer an uv light.
Lizards prefer light.,Lizards prefer visible light.
Wood turtles return to streams.,Wood turtles return to freshwater streams.
Wood turtles return to streams.,Wood turtles return to small streams.
Wood turtles return to streams.,Wood turtles return to rivers.
Snakes feed on insects.,Snakes feed on insects.
Venomous snakes possess fangs.,Venomous snakes possess fangs.
Lizards sit in sand.,Lizards sit in a desert sand.
Lizards sit in sand.,Lizards sit in a beach sand.
Lizards sit in sand.,Lizards sit in a sand.
Lizards sit in sand.,Lizards sit in a play sand.
Crocodiles play in water.,Crocodiles play in water.
Snakes have only one well-developed right lung.,Snakes have only one well-developed right lung.
Snakes eat grind squirrels.,Snakes eat ground squirrels.
Snakes eat grind squirrels.,Snakes eat small rodents.
Wasp colonies have queen wasps.,Wasp colonies have a queen wasp.
Wasp colonies have queen wasps.,Wasp colonies have queen wasps.
Green snakes live in trees.,Green snakes live in the green snake lives in trees that have leaves.
Snakes eat insects.,Snakes eat crickets.
Snakes eat insects.,Snakes eat insects.
Snakes eat insects.,Snakes eat beetles.
Snake venom enters blood streams.,A snake venom enters the blood stream of the victim.
Snake venom enters blood streams.,A snake venom enters the blood stream of the prey.
Snake venom enters blood streams.,A snake venom enters the blood stream of the snake.
Crocodiles emerge from nests.,Crocodiles emerge from nests.
Lizards eat snails.,Lizards eat land snails.
Vipers reach sexual maturity.,Vipers reach sexual maturity.
Snakes live in waterways.,Snakes live in wetlands.
Saltwater crocodiles survive for many months.,Saltwater crocodiles survive for a long period of time.
Saltwater crocodiles survive for many months.,Saltwater crocodiles survive for a significant amount of time.
Asparagus beetles attack wild plants.,Asparagus beetles attack wild asparagus.
Saltwater crocodiles eat sharks.,Saltwater crocodiles eat sharks.
American crocodiles eat turtles.,American crocodiles eat soft-shell turtles.
American crocodiles eat turtles.,American crocodiles eat sea turtles.
Jerboas eat insects.,Jerboas eat arachnids.
Jerboas eat insects.,Jerboas eat other invertebrates.
Jerboas eat insects.,Jerboas eat insects.
Snakes eat bullfrog tadpoles.,Snakes eat frog tadpoles.
Crocodiles invade ponds.,Crocodiles invade small ponds.
Snakes prey upon water snakes.,Snakes prey upon water snakes.
Crocodiles eat people.,Crocodiles eat people.
Crocodiles live in lagoons.,Crocodiles live in saltwater lagoons.
Crocodiles live in lagoons.,Crocodiles live in fresh water lagoons.
Crocodiles live in lagoons.,Crocodiles live in salt water lagoons.
