generic,exemplar
Tree kangaroos have tails.,Tree kangaroos have a long tail.
Opossums have teeth.,Opossums have incisors.
Opossums have teeth.,Opossums have canines.
Opossums have teeth.,Opossums have molars.
Anteaters have mouths.,Anteaters have a mouth.
Hedgehogs enter into hibernation.,Hedgehogs enter into a seasonal hibernation.
Hedgehogs enter into hibernation.,Hedgehogs enter into a true hibernation.
Hedgehogs enter into hibernation.,Hedgehogs enter into torpor.
Hedgehogs enter into hibernation.,Hedgehogs enter into a winter torpor.
Hedgehogs enter into hibernation.,Hedgehogs enter into a daily torpor.
Hedgehogs enter into hibernation.,Hedgehogs enter into a winter sleep.
Caterpillars go through metamorphosis.,Caterpillars go through a caterpillar goes through complete metamorphosis.
Gazelles live on grassland.,Gazelles live on a meadow.
Gazelles live on grassland.,Gazelles live on a grassland.
Gazelles live on grassland.,Gazelles live on grasslands near water.
Gazelles live on grassland.,Gazelles live on grasslands.
Mandrills have teeth.,"Mandrills have mandrills have incisors, canines, and molars."
Mandrills have teeth.,Mandrills have incisors.
Mandrills have teeth.,Mandrills have canines.
Meerkats have membranes.,Meerkats have mucous membranes.
Box jellyfish have tentacles.,Box jellyfish have tentacle-like appendages.
Box jellyfish have tentacles.,Box jellyfish have tentacle-like projections.
Box jellyfish have tentacles.,Box jellyfish have tentacles.
Box jellyfish have tentacles.,Box jellyfish have true tentacles.
Box jellyfish have tentacles.,Box jellyfish have appendages.
Dogs die at ages.,Dogs die at an old age.
Rabbits give birth to rabbits.,Rabbits give litters.
Caterpillars feed on weeds.,Caterpillars feed on noxious weeds.
Zebras have ears.,Zebras have pinnae (external ears).
Zebras have ears.,Zebras have external ears.
Dentigerous cysts are solitary.,Dentigerous cysts are dentigerous cysts are a type of solitary cyst.
Aardvarks eat insects.,Aardvarks eat beetles.
Young chimpanzees stay with mothers.,Young chimpanzees stay with a mother.
Young chimpanzees stay with mothers.,Young chimpanzees stay with nurturing mothers.
Bobcats have elliptical pupils.,Bobcats have some bobcats have elliptical pupils.
Antelopes adapt to conditions.,Antelopes adapt to weather.
Salamanders are inside streams.,Salamanders are inside a river.
Salamanders are inside streams.,Salamanders are inside rivers.
Salamanders are inside streams.,Salamanders are inside streams.
Persian buttercups grow from bulbs.,Persian buttercups grow from bulbs.
Frogs survive predation.,Frogs survive an animal predation.
Snow leopards have tails.,Snow leopards have a bushy tail.
Moles are brownish but they can be flesh colored.,Moles are brownish but they can also be flesh colored.
Leopard geckos eat bugs.,Leopard geckos eat arachnids.
Leopard geckos eat bugs.,Leopard geckos eat insects.
Squirrels shake tails.,Squirrels shake a tail-like object.
Squirrels shake tails.,Squirrels shake a tail.
Elephants feed on leaves.,Elephants feed on broad leaves from trees.
Bears survive habitats.,Bears survive a forest.
Elephants live in groups.,Elephants live in family groups.
Elephants live in groups.,Elephants live in a group.
Elephants live in groups.,Elephants live in mixed groups.
Spider monkeys feed on fruit.,"Spider monkeys feed on banana, apple, grape, orange, pineapple, mango, watermelon."
Spider monkeys feed on fruit.,Spider monkeys feed on fruit.
Bison thrive in habitats.,"A bison thrive in grasslands, woodlands, meadows, plains, mountains."
Bison thrive in habitats.,A bison thrive in rangelands.
Bison thrive in habitats.,A bison thrive in prairies.
Honey badgers survive in habitats.,Honey badgers survive in a forest.
Honey badgers survive in habitats.,Honey badgers survive in woodlands.
Walruses have teeth.,"Walruses have walruses have incisors, canines, and molars."
Walruses have teeth.,Walruses have molars.
Walruses have teeth.,Walruses have canines.
Wolves live on food.,Wolves live on meat.
Gorillas have teeth.,Gorillas have incisors.
Gorillas have teeth.,Gorillas have molars.
Gorillas have teeth.,Gorillas have canines.
Salamanders can regenerate their limbs.,Salamanders are able to regrow a lost limb.
Salamanders can regenerate their limbs.,Salamanders are able to regenerate their limbs.
Coyotes eat rodents.,Coyotes eat mice.
Coyotes eat rodents.,Coyotes eat rats.
Humans alter natural habitats.,Humans alter a forest.
Humans alter natural habitats.,Humans alter rural landscapes.
Tree frogs find shelter in the trees.,Tree frogs find under the bark of a tree.
Armadillos feed on termites.,Armadillos feed on subterranean termites.
Shrews have brown fur.,Shrews have a brown fur on the back.
Shrews have brown fur.,Shrews have brown fur on the dorsal surface.
Pacific walruses live in sea.,Pacific walruses live in pacific walruses live in the pacific ocean.
Pacific walruses live in sea.,Pacific walruses live in the sea.
Pacific walruses live in sea.,Pacific walruses live in the ocean.
Western gorillas live at zoos.,Western gorillas live at zoos.
Western gorillas live at zoos.,Western gorillas live at zoological parks.
Monk seals have big eyes.,Monk seals have great eyes-large eyes-huge eyes-enormous eyes.
Monk seals have big eyes.,Monk seals have large eyes.
Monk seals have big eyes.,Monk seals have great eyes.
Monk seals have big eyes.,Monk seals have distinctive eyes.
Cats feed on fish.,Cats feed on small fish.
Cats feed on fish.,Cats feed on fish.
Human milk contains lactose.,A human milk contains lactose.
Oxygen is produced by plankton in the sea.,An Oxygen is produced by phytoplankton.
Oxygen is produced by plankton in the sea.,An Oxygen is produced by plankton.
Guinea pigs have membranes.,Guinea pigs have mucous membranes.
Respiration requires oxygen.,A respiration requires oxygen from the air.
Respiration requires oxygen.,A respiration requires o2 from the air.
Respiration requires oxygen.,A respiration requires an oxygen gas.
Respiration requires oxygen.,A respiration requires oxygen atoms.
Jaguars live in central and south america.,Jaguars live in central and south america.
Jaguars live in central and south america.,Jaguars live in central america.
Humans eat plants.,Humans eat vegetables.
Rats have coats.,Rats have a heat-conserving coat.
Rats have coats.,Rats have a pelage coat.
Chimpanzees share ancestors.,Chimpanzees share chimpanzees share a common ancestor with humans.
Peroxide reacts with compounds.,A peroxide reacts with inorganic compounds.
Peroxide reacts with compounds.,A peroxide reacts with organic compounds.
Sheep live in meadows.,Sheep live in a grassland meadow.
Monkeys have sharp teeth.,Monkeys have sharp incisors.
Monkeys have sharp teeth.,Monkeys have incisors.
Monkeys have sharp teeth.,Monkeys have canines.
Monkeys have sharp teeth.,Monkeys have sharp canines.
Monkeys have sharp teeth.,Monkeys have molars.
Monkeys have sharp teeth.,Monkeys have sharp molars.
Vertebrates live on ground.,Vertebrates live on land.
Surface temperature contributes to heat.,A surface temperature contributes to a conduction heat.
Body temperature depends on environments.,"A body temperature depends on external environment (ambient air temperature, humidity, wind)."
Body temperature depends on environments.,A body temperature depends on a microenvironment.
Caterpillars feed on host plants.,"Caterpillars feed on a variety of trees, shrubs, and plants."
Caterpillars feed on host plants.,"Caterpillars feed on a particular type of tree, shrub, or plant."
Zebras have skin.,Zebras have a zebra skin.
Moose have slender legs.,Moose have lean legs.
Koalas have teeth.,Koalas have incisors.
Bats kill prey.,Bats kill small mammals.
Bats kill prey.,Bats kill small animals.
Goats have horns.,Goats have a goats have two horns on their head.
Goats have horns.,Goats have horn tips.
Bowhead whales have massive skulls.,Bowhead whales have gargantuan skulls.
Bowhead whales have massive skulls.,Bowhead whales have one type of massive skull is the bowhead whale's.
Bowhead whales have massive skulls.,Bowhead whales have large skulls.
Bowhead whales have massive skulls.,Bowhead whales have huge skulls.
Domestic cats kill  birds.,Domestic cats kill waterfowl.
Squirrels sit on branches.,Squirrels sit on tree branches.
Dolphins maintain streamline body shapes.,Dolphins maintain a streamlined body.
Nutrias have round tails.,Nutrias have a broad round tail.
Spinner dolphins eat fish.,Spinner dolphins eat small pelagic fish.
Spinner dolphins eat fish.,Spinner dolphins eat small fish.
Frogs eat grasshoppers.,Frogs eat grasshoppers.
Philippine tarsiers have fur.,"Philippine tarsiers have a coat of long, fine hairs."
Pronghorns have lungs.,Pronghorns have paired lungs.
Australian dingos are descended from dogs.,Australian dingos are descended from domestic dogs.
Rats eat dog food.,Rats eat dog kibble.
Rats eat dog food.,Rats eat leftover dog food.
Dogs use sharp teeth.,Dogs use incisors.
Pheasants have bellies.,Pheasants have a stomach.
Tree sloths live in trees.,Tree sloths live in tree sloths live in trees.
Tree sloths live in trees.,Tree sloths live in tree-dwelling.
Tree sloths live in trees.,Tree sloths live in arboreal.
Elephants feed on plants.,Elephants feed on shrubs.
Elephants feed on plants.,Elephants feed on vines.
Marmots hibernate in burrows.,Marmots hibernate in marmots typically hibernate in burrows dug into the ground.
Marmots hibernate in burrows.,Marmots hibernate in underground.
Salamanders have moist skin.,Salamanders have a fleshy skin.
Salamanders have moist skin.,Salamanders have a wet skin.
Chameleons consume prey.,Chameleons consume other small vertebrates.
Chameleons consume prey.,Chameleons consume small mammals.
Chameleons consume prey.,Chameleons consume insects.
Foxes eat sheep.,"Foxes eat sheep, lamb, mutton, rams, ewes."
Foxes eat sheep.,Foxes eat ewes.
Arctic hares have coats.,Arctic hares have a winter coat.
Arctic hares have coats.,Arctic hares have coats of fur.
Tunicates have predators.,Tunicates have animal predators.
Leopards eat prey.,Leopards eat insects.
Leopards eat prey.,Leopards eat birds.
Wolves have teeth.,Wolves have canines.
Wolves have teeth.,Wolves have incisors.
Wolves have teeth.,Wolves have molars.
Mice feed in fields.,Mice feed in rural areas.
Mice feed in fields.,Mice feed in grasslands.
Mice feed in fields.,Mice feed in farmlands.
Zebras eat plants.,"Zebras eat zebras eat grass, hay, and other plant-based food."
Dingos have short.,Dingos have a short hair.
Dingos have short.,Dingos have a short fur.
Armadillos have claws.,Armadillos have sharp claws on its front paws.
Armadillos have claws.,Armadillos have sharp claws.
Armadillos have claws.,Armadillos have defense claws.
Honey badgers have short legs.,Honey badgers have legs that are proportionately short for their body size.
Honey badgers have short legs.,Honey badgers have legs that are disproportionately short for their body size.
Honey badgers have short legs.,Honey badgers have they have short legs relative to their body size.
Honey badgers have short legs.,Honey badgers have relative short legs.
Pheasants have feet.,Pheasants have pheasant feet.
Tapeworms absorb food.,Tapeworms absorb organic matter.
Tapeworms absorb food.,Tapeworms absorb an organism.
Rabbits have legs.,Rabbits have front legs.
Rabbits have legs.,Rabbits have legs.
Rabbits have legs.,Rabbits have rabbits have four legs.
Bears live in mountains.,Bears live in mountain ranges.
Meerkats live in underground burrows.,Meerkats live in underground burrows.
Meerkats live in underground burrows.,Meerkats live in burrows.
Cheetahs have fur.,Cheetahs have hair.
Cheetahs have fur.,Cheetahs have a fur.
Elephants eat fruit.,Elephants eat fruit.
Elephants eat fruit.,Elephants eat berries.
Cellular respiration involves oxygen.,A cellular respiration involves an oxygen molecule.
Cellular respiration involves oxygen.,A cellular respiration involves an o2 from the air.
Cellular respiration involves oxygen.,A cellular respiration involves an oxygen gas.
Cellular respiration involves oxygen.,A cellular respiration involves an o2.
Cellular respiration involves oxygen.,A cellular respiration involves an o2 gas.
Vertebrates have blood.,Vertebrates have red blood cells.
Vertebrates have blood.,Vertebrates have white blood cells.
Vertebrates have blood.,Vertebrates have a blood plasma.
Ferrets prefer to sleep within a relatively small.,Ferrets prefer to sleep in a small enclosed space.
Ferrets prefer to sleep within a relatively small.,Ferrets prefer to sleep in a relatively small enclosed area.
Ferrets prefer to sleep within a relatively small.,Ferrets prefer to sleep in a small dark space.
Ferrets prefer to sleep within a relatively small.,Ferrets prefer to sleep in a small radius around their bed.
Ferrets prefer to sleep within a relatively small.,Ferrets prefer to sleep in a small quiet space.
Ferrets prefer to sleep within a relatively small.,Ferrets prefer to sleep in a relatively small dark enclosed area.
Squirrels have ranges.,Squirrels have home ranges.
Squirrels have ranges.,Squirrels have territory ranges.
Mice live on ground.,Mice live on farmland.
Mice live on ground.,Mice live on ground.
Vertebrates live on earth.,Vertebrates live on terrestrial.
Bats grow hair.,Bats grow a fur.
Bats grow hair.,Bats grow a hair.
Manatees give birth to calves.,Manatees give a single calf is born to a manatee mother.
Manatees give birth to calves.,Manatees give a calf birth.
Aardvarks have noses.,"Aardvarks have a large, protruding nose."
Aardvarks have noses.,"Aardvarks have a small, upturned nose."
Aardvarks have noses.,Aardvarks have a long nose.
Batteries generate voltage.,Batteries generate a voltage.
Batteries generate voltage.,Batteries generate an electronic voltage.
Batteries generate voltage.,Batteries generate a chemical voltage.
Complex carbohydrates are high fiber foods that digest more slowly.,Complex carbohydrates are high fiber foods slow digesting carbohydrates.
Dolphins swim in oceans.,Dolphins swim in the atlantic ocean.
Dolphins swim in oceans.,Dolphins swim in an atlantic ocean.
Gorillas have massive heads.,Gorillas have massive bone heads.
Gorillas have massive heads.,Gorillas have massive muscle heads.
Gorillas have massive heads.,Gorillas have massive hair heads.
Gorillas have massive heads.,Gorillas have massive skull heads.
Foxes eat rodents.,Foxes eat mice.
Foxes eat rodents.,Foxes eat rats.
Dogs have powerful jaws.,Dogs have crushing jaws.
Dogs have powerful jaws.,Dogs have jaws.
Perspiration removes heat.,A perspiration removes body heat.
Perspiration removes heat.,A perspiration removes an environmental heat.
Lions are classified as predatory animals.,Lions are classified as a carnivore.
Lions are classified as predatory animals.,Lions are classified as carnivores.
Lions are classified as predatory animals.,Lions are classified as an apex predator.
Lions are classified as predatory animals.,Lions are classified as apex predators.
Chipmunks eat vegetation.,Chipmunks eat coniferous plants.
Chipmunks eat vegetation.,Chipmunks eat deciduous plants.
Chipmunks eat vegetation.,Chipmunks eat vegetables.
Chipmunks eat vegetation.,Chipmunks eat herbaceous plants.
Rock hyraxes feed on grass.,Rock hyraxes feed on grass.
Gorillas live at zoos.,Gorillas live at zoos.
Gorillas live at zoos.,Gorillas live at zoo-like facilities.
Gorillas have coats.,Gorillas have a coat of fur.
Complex carbohydrates help energy.,Complex carbohydrates help physical energy to do work.
Complex carbohydrates help energy.,Complex carbohydrates help physical energy.
Frogs have short legs.,Frogs have short forelimbs.
Frogs have short legs.,Frogs have short legs.
Frogs have short legs.,Frogs have tiny legs.
Rabbits hide in ground.,Rabbits hide in grass.
Polar bears have glands.,Polar bears have exocrine glands.
Canada lynxes have ears.,"Canada lynxes have small, rounded ears."
Canada lynxes have ears.,"Canada lynxes have long, pointed ears."
Chilean dolphins feed on water fish.,Chilean dolphins feed on fish.
Elephants carry babies.,Elephants carry young.
Bilbies have soft fur.,Bilbies have a soft fur on their head.
Bilbies have soft fur.,Bilbies have a soft fur on their body.
Bilbies have soft fur.,Bilbies have soft fur on their bodies.
Giraffes have eyesights.,Giraffes have a farsightedness.
Giraffes have eyesights.,Giraffes have an ability to see color.
Giraffes have eyesights.,Giraffes have normal eyesight.
Cheetahs eat gazelles.,Cheetahs eat gazelle.
Bilbies have long snouts.,Bilbies have a they have a long snout like a cat.
Bilbies have long snouts.,Bilbies have a they have a long snout like a pig.
Bilbies have long snouts.,Bilbies have a they have a long nose like a dog.
Bilbies have long snouts.,"Bilbies have long, slender snouts."
Bilbies have long snouts.,Bilbies have long-nosed.
Bilbies have long snouts.,Bilbies have long noses.
Bilbies have long snouts.,Bilbies have nose is long and slender.
Tunicates have testes.,Tunicates have testes.
Bears possess ribs.,Bears possess ribs are the bones that make up the ribcage.
Bears possess ribs.,Bears possess a ribs on the back.
Jackals eat flesh.,Jackals eat a dead animal.
Jackals eat flesh.,Jackals eat small animals.
Jackals eat flesh.,Jackals eat animal flesh.
Jackals eat flesh.,Jackals eat meat.
Sperm whales have brains.,Sperm whales have a large brain.
Sperm whales have brains.,Sperm whales have the sperm whale has a large brain.
Antelopes have slender legs.,Antelopes have thin legs.
Tigers have fur.,Tigers have a body fur.
Caterpillars have eyespots.,Caterpillars have eye-like spots on the body.
Tapeworms live in small intestines.,Tapeworms live in small intestines of vertebrates including humans.
Tapeworms live in small intestines.,Tapeworms live in small intestines of other animals.
Tapeworms live in small intestines.,Tapeworms live in small intestines of humans.
Tapeworms live in small intestines.,Tapeworms live in fish small intestines.
Giant anteaters have teeth.,Giant anteaters have sharp incisors.
Giant anteaters have teeth.,Giant anteaters have molars.
Catheters insert into ureters.,Catheters insert into an urethra.
Catheters insert into ureters.,Catheters insert into urine.
Catheters insert into ureters.,Catheters insert into urinary.
Caterpillars appear in gardens.,Caterpillars appear in a garden.
Dogs survive in climates.,Dogs survive in a dogs can survive in a cold climate.
Dogs survive in climates.,Dogs survive in a dogs can survive in a dry climate.
Dogs survive in climates.,Dogs survive in a dogs can survive in a warm climate.
Dogs survive in climates.,Dogs survive in temperate.
Monkeys spend their entire life in the trees.,Monkeys spend monkeys can spend their entire life in the trees.
Armadillos have teeth.,Armadillos have molars.
Deer have skinny legs.,Deer have legs that are thin and sinewy.
Deer have skinny legs.,Deer have legs that are slender and spindly.
Chimpanzees have thumbs.,Chimpanzees have opposable thumbs.
Chimpanzees have thumbs.,Chimpanzees have long opposable thumbs.
Modern humans have bones.,Modern humans have a humerus.
Modern humans have bones.,Modern humans have vertebrae.
Bull sharks survive in fresh water.,Bull sharks survive in fresh water estuaries.
Bull sharks survive in fresh water.,Bull sharks survive in fresh water.
Bull sharks survive in fresh water.,Bull sharks survive in fresh water lakes.
Foxes have tails.,Foxes have a bushy tail.
Foxes have tails.,Foxes have tail in the air-tail straight up-tail down.
Raccoons adapt to habitats.,Raccoons adapt to rural areas.
Raccoons adapt to habitats.,Raccoons adapt to a forest.
Raccoons adapt to habitats.,Raccoons adapt to forests.
Raccoons adapt to habitats.,Raccoons adapt to a woodland.
Raccoons adapt to habitats.,Raccoons adapt to rural.
Deer mice have forelimbs.,Deer mice have front legs.
Deer mice have forelimbs.,Deer mice have front limbs.
Deer mice have forelimbs.,Deer mice have forearms.
Pheasants survive late winter.,Pheasants survive late winter in the pheasant's native range.
Pheasants survive late winter.,Pheasants survive a late winter.
Bats spend the day sleeping in their roost.,Bats spend most bats sleep during the day in their roost.
Otters have teeth.,Otters have sharp incisors.
Otters have teeth.,Otters have incisors.
Otters have teeth.,Otters have canines.
Otters have teeth.,Otters have molars.
Dogs produce cortisol.,Dogs produce a cortisol hormone.
Frogs are nocturnal.,"Frogs are there are many types of nocturnal animals, including frogs."
Opossums have long hairless tails.,Opossums have tails that are long and hairless.
Opossums have long hairless tails.,Opossums have long tails.
Salamanders live in habitats.,Salamanders live in wetlands.
Gopher tortoises have strong legs.,"Gopher tortoises have a muscular, sturdy body."
Spinner dolphins live in ocean water.,Spinner dolphins live in salt water.
Spinner dolphins live in ocean water.,Spinner dolphins live in marine water.
Spinner dolphins live in ocean water.,Spinner dolphins live in pelagic.
Ossification produces bones.,An ossification produces a vertebrae.
Servals have ears.,Servals have big ears.
Servals have ears.,Servals have auditory ossicles.
Servals have ears.,Servals have an auditory nerve.
Deer have huge antlers.,Deer have antlers.
Horses live on vegetation.,Horses live on grass.
Dugongs have glands.,Dugongs have glandular tissue in the skin.
Pheasants survive winter.,Pheasants survive winters with severe cold.
Goats thrive in habitats.,Goats thrive in rangeland.
Goats thrive in habitats.,Goats thrive in a woodland.
Pigment reflects light.,A pigment reflects a light reflectance spectrum.
Pigment reflects light.,A pigment reflects a visible light.
Pigment reflects light.,A pigment reflects a types of light.
Pigment reflects light.,A pigment reflects an electromagnetic radiation.
Pygmy tarsiers have short limbs.,Pygmy tarsiers have short limbs.
Wildebeests eat plants.,Wildebeests eat shrubs.
Wildebeests eat plants.,Wildebeests eat other plants.
Marmots regulate temperature.,Marmots regulate internal body temperature.
Marmots regulate temperature.,Marmots regulate body temperature.
Marmots regulate temperature.,Marmots regulate temperate.
Squirrels seek food.,Squirrels seek small rodents.
Giraffes have tongues.,Giraffes have licking tongues.
Giraffes have tongues.,Giraffes have sucking tongues.
Giraffes have tongues.,Giraffes have probing tongues.
Large antelopes rely on vegetation.,Large antelopes rely on grasses.
Caterpillars shed skin.,Caterpillars shed a caterpillar skin.
Echidnas have long snouts.,"Echidnas have long, pointed snouts."
Echidnas have long snouts.,Echidnas have the echidna has a pointed long snout.
Female hyenas possess reproductive organs.,Female hyenas possess a clitoris.
Female hyenas possess reproductive organs.,Female hyenas possess a vulva.
Female hyenas possess reproductive organs.,Female hyenas possess ovaries.
Female hyenas possess reproductive organs.,Female hyenas possess a vagina.
Female hyenas possess reproductive organs.,Female hyenas possess the vagina.
Female hyenas possess reproductive organs.,Female hyenas possess an uterus.
Elephants possess blood.,Elephants possess red blood cells.
Elephants possess blood.,Elephants possess hemoglobin.
Squirrels eat diets.,Squirrels eat other small animals.
Marmosets have ears.,Marmosets have an ear canal.
Gorillas have ranges.,Gorillas have a ranges of locomotion.
Gorillas have ranges.,Gorillas have a ranges of vocalization.
Gorillas have ranges.,Gorillas have a ranges of territory.
European badgers feed on insects.,European badgers feed on grubs.
European badgers feed on insects.,European badgers feed on insects.
European badgers feed on insects.,European badgers feed on beetles.
Polar bears have senses.,Polar bears have the polar bear has a well-developed sense of smell.
Polar bears have senses.,Polar bears have a smell.
Polar bears have senses.,Polar bears have a sight.
Polar bears have senses.,Polar bears have hearing.
Polar bears have senses.,Polar bears have smell.
Beavers have teeth.,Beavers have incisors.
Beavers have teeth.,Beavers have canines.
Beavers have teeth.,Beavers have molars.
Albatrosses reach maturity.,Albatrosses reach a fledging maturity.
Albatrosses reach maturity.,Albatrosses reach reproductive maturity.
Albatrosses reach maturity.,Albatrosses reach a physical maturity.
Albatrosses reach maturity.,Albatrosses reach mental maturity.
Albatrosses reach maturity.,Albatrosses reach a growth maturity.
Rabbits have thymuses.,Rabbits have a thymus gland.
Rabbits have thymuses.,Rabbits have a thymic organ.
Rabbits have thymuses.,Rabbits have thymic lobes.
Aardvarks have long slender noses.,Aardvarks have long and slender noses.
Female platypuses use tails.,Female platypuses use a tail for balance.
Mice grow adult teeth.,Mice grow incisors.
Mice grow adult teeth.,Mice grow molars.
Baboons have upper teeth.,Baboons have canines.
Bison thrive in grassland.,A bison thrive in a shortgrass prairie.
Bison thrive in grassland.,A bison thrive in a tallgrass prairie.
Bison thrive in grassland.,A bison thrive in tallgrass prairies.
Bison thrive in grassland.,A bison thrive in shortgrass prairies.
Tigers are tawny brown in color with dark stripes and whitish stomachs.,Tigers are tawny brown in with tigers may have dark stripes and whitish stomachs.
Squirrels eat food.,Squirrels eat other small animals.
Grasshopper mice eat grasshoppers.,Grasshopper mice eat grasshoppers.
Grasshopper mice eat grasshoppers.,Grasshopper mice eat true grasshoppers.
Grasshopper mice eat grasshoppers.,Grasshopper mice eat ordinary grasshoppers.
Tigers are solitary.,Tigers are solitary animals are those who live alone.
Tigers are solitary.,Tigers are tigers are solitary animals.
Newborn rats respond to food.,Newborn rats respond to a protein.
Water buffalo feeds on aquatic plants.,A water buffalo feeds on species of aquatic plants.
