generic,exemplar
Intoxications are caused by ingestion.,Intoxications are caused by ingestion of a drug.
Bears kill animals.,"Bears kill bears kill deer, elk, moose, and other hoofed mammals."
Cheetahs depend on legs.,Cheetahs depend on their hind legs are longer than their front legs.
Cheetahs depend on legs.,Cheetahs depend on legs for running.
Cheetahs depend on legs.,Cheetahs depend on tendons.
Cheetahs depend on legs.,Cheetahs depend on running legs.
Lions have fur.,"Lions have a short, dense undercoat of fur."
Squirrels survive winter.,Squirrels survive a temperate winter.
Colobus monkeys have fingers.,Colobus monkeys have fingers.
Bottlenose dolphins search for prey.,Bottlenose dolphins search for mollusks.
Bottlenose dolphins search for prey.,Bottlenose dolphins search for fish.
Black bears produce offspring.,Black bears produce black bear cubs.
Black bears produce offspring.,Black bears produce a male and female.
Porpoises inhabit offshore water.,Porpoises inhabit the open ocean.
Porpoises inhabit offshore water.,Porpoises inhabit open ocean waters.
Porpoises inhabit offshore water.,Porpoises inhabit offshore waters.
Moose have eyesights.,Moose have a forward facing eyes that provide nearly 360 degree vision.
Pickerel frogs have skin secretion.,Pickerel frogs have skin secretions.
Spinner dolphins live in warm ocean water.,Spinner dolphins live in tropical waters.
Spinner dolphins live in warm ocean water.,Spinner dolphins live in pelagic waters.
Dogs give birth to dogs.,Dogs give pups.
Foxes eat mice.,Foxes eat field mice.
Pigs reach puberty.,Pigs reach sexual maturity-the ability to reproduce.
Pigs reach puberty.,Pigs reach a maturation of the reproductive system.
Pigs reach puberty.,Pigs reach maturation of the reproductive organs.
Pigs reach puberty.,Pigs reach sexual maturity.
Pigs reach puberty.,Pigs reach a physical maturity.
Zebras have molars.,Zebras have molars.
Panthers have whiskers.,Panthers have a hair on the chin.
Panthers have whiskers.,Panthers have hair on the cheeks.
Panthers have whiskers.,Panthers have a hair on the muzzle.
Gazelles survive in deserts.,Gazelles survive in semi-arid deserts.
Gazelles survive in deserts.,Gazelles survive in arid deserts.
Platypuses have blood.,Platypuses have red blood cells.
Blue whales have eyes.,Blue whales have they use their eyes to see.
Killer whales have senses.,Killer whales have an olfactory.
Killer whales have senses.,Killer whales have a smell.
Killer whales have senses.,Killer whales have a sight.
Killer whales have senses.,Killer whales have hearing.
Killer whales have senses.,Killer whales have visual.
Antelopes adapt to water.,Antelopes adapt to waterholes.
Antelopes adapt to water.,Antelopes adapt to water holes.
Squirrels have limbs.,Squirrels have front legs.
Squirrels have limbs.,Squirrels have legs.
Dogs have eyes.,Dogs have eyes that can be dilated.
Bats have eyes.,Bats have eye sockets.
Squirrels hide nuts.,Squirrels hide almonds.
Marmots regulate internal temperature.,Marmots regulate core body temperature.
Marmots regulate internal temperature.,Marmots regulate a body core temperature.
Marmots regulate internal temperature.,Marmots regulate internal organ temperature.
Bats rest .,Bats are able to resting during periods of inactivity.
Bats rest .,Bats are able to resting during hibernation.
Humans are active during the day.,Humans are active during a day.
Humans are active during the day.,Humans are active during weekdays.
Humans are active during the day.,Humans are active during an afternoon.
Frogs live in ponds.,Frogs live in ponds.
Reindeer have legs.,Reindeer have reindeer legs.
Salamanders have moist.,Salamanders have a moist skin.
Salamanders have moist.,Salamanders have a moist environment.
Salamanders have moist.,Salamanders have a moist habitat.
Squirrels require water.,Squirrels require water to drink.
Squirrels require water.,Squirrels require water.
Elephants have legs.,Elephants have four legs.
Elephants have legs.,Elephants have hind legs.
Fruit bats have teeth.,Fruit bats have incisors.
Fruit bats have teeth.,Fruit bats have canines.
Fruit bats have teeth.,Fruit bats have molars.
Arctic foxes have thick fur.,Arctic foxes have a thick undercoat of fur for insulation.
Bats occur in habitats.,Bats occur in woodlands.
Bats absorb heat.,Bats absorb thermal energy (heat).
Bats absorb heat.,Bats absorb radiant energy.
Bats absorb heat.,Bats absorb thermal radiation.
Moose have legs.,Moose have four legs.
Eastern newts eat worms.,Eastern newts eat earthworms.
Red squirrels survive winter.,Red squirrels survive a winter in the temperate zone.
Red squirrels survive winter.,Red squirrels survive red squirrels can survive in temperate winter climates.
Red squirrels survive winter.,Red squirrels survive cold winters.
Red squirrels survive winter.,Red squirrels survive snowy winters.
Red squirrels survive winter.,Red squirrels survive stores of food.
Dogs carry fleas.,Dogs carry dog fleas.
Prairie dogs have legs.,Prairie dogs have front legs.
Batteries supply electrical power.,Batteries supply an electric current.
Batteries supply electrical power.,Batteries supply energy.
Batteries supply electrical power.,Batteries supply power.
Batteries supply electrical power.,Batteries supply electricity.
Big cats have claws that they use to grip and tear.,Big cats have sharp claws for gripping and tearing.
Antelopes have exceptional eyesights.,Antelopes have an ability to see well in low light.
Chameleons adapt color.,Chameleons adapt an imitation of the color of their background.
Chameleons adapt color.,Chameleons adapt a change in their skin color.
Chameleons adapt color.,Chameleons adapt the colors of other nearby objects.
Chameleons adapt color.,Chameleons adapt a skin color.
Chameleons adapt color.,Chameleons adapt specific colors.
Chameleons adapt color.,Chameleons adapt a scale color.
Bottlenose dolphins live along coasts.,Bottlenose dolphins live along the atlantic coast.
Bottlenose dolphins live along coasts.,Bottlenose dolphins live along atlantic coast.
African elephants have ears.,African elephants have big ears that stick out.
African elephants have ears.,African elephants have big ears.
African elephants have ears.,African elephants have large flapping ears.
Young squirrels live on nuts.,"Young squirrels live on acorns, hickory nuts, walnuts, butternuts, pecans, chestnuts."
Porpoises feed on fish.,Porpoises feed on small fish.
Porpoises feed on fish.,Porpoises feed on fish.
Panthers live in jungle.,Panthers live in a tropical rainforest.
Panthers live in jungle.,Panthers live in a rainforest.
Panthers live in jungle.,Panthers live in a tropical forest.
Tapeworms cause blockage.,Tapeworms cause an intestinal obstruction.
Tapeworms cause blockage.,Tapeworms cause a bowel obstruction.
Marmots have dark brown feet.,Marmots have dark brown feet.
Fly squirrels move from trees.,Fly squirrels move from trees in which they live.
Bears emerge from dens.,Bears emerge from a den.
Humans have two arms each .,Humans have biceps and forearms.
Humans have two arms each .,Humans have triceps and forearms.
Humans have two arms each .,Humans have arms.
Cats kill mice.,Cats kill a house mouse.
Cats kill mice.,Cats kill house mice.
Moth caterpillars eat leaves.,Moth caterpillars eat leaves of trees.
Moth caterpillars eat leaves.,Moth caterpillars eat broadleaved trees.
Rats have noses.,"Rats have nares, or nostrils."
Willow flycatchers feed on insects.,Willow flycatchers feed on other small insects.
Willow flycatchers feed on insects.,Willow flycatchers feed on insects.
Willow flycatchers feed on insects.,Willow flycatchers feed on flies.
Aardvarks feed on ants.,"Aardvarks feed on aardvarks feed on termites, ants, and other insects."
Gorillas have arms.,Gorillas have forelimbs.
Gorillas have arms.,Gorillas have long arms.
Apes give birth to offspring.,Apes give the birth of a baby ape.
Foxes kill prey.,Foxes kill other small mammals.
Foxes kill prey.,Foxes kill other small animals.
Tigers have powerful jaws.,Tigers have powerful jaw muscles for crushing.
Vertebrates have limbs.,Vertebrates have appendages.
Vertebrates have limbs.,Vertebrates have arms.
Vertebrates have limbs.,Vertebrates have legs.
Frogs have white undersides.,Frogs have an underbelly is white in color.
Frogs have white undersides.,Frogs have a belly (underside) is white in color.
Frogs have white undersides.,Frogs have an underparts are white in color.
Mule deer have tails.,Mule deer have a long tail.
Gazelles eat grass.,Gazelles eat grass.
Golden frogs have smooth skin.,Golden frogs have the golden frog has smooth skin.
Humans have oxygen.,Humans have oxygen in the blood.
Humans have oxygen.,Humans have oxygen in the air.
Humans have oxygen.,Humans have oxygen atoms.
Humans have oxygen.,Humans have a molecular oxygen.
Foxes live in woodlands.,Foxes live in coniferous forests.
Foxes live in woodlands.,Foxes live in a coniferous forest.
Foxes live in woodlands.,Foxes live in deciduous forests.
Foxes live in woodlands.,Foxes live in a mixed forest.
Dolphins eat prey.,Dolphins eat mollusks.
Dolphins eat prey.,Dolphins eat crustaceans.
Dolphins eat prey.,Dolphins eat other aquatic creatures.
Dolphins eat prey.,Dolphins eat fish.
Mice have skin.,Mice have an epidermis.
Mice have skin.,Mice have a dermis.
Deer flies require a blood meal to develop eggs.,Deer flies require deer flies require a blood meal to lay eggs.
Deer flies require a blood meal to develop eggs.,Deer flies require deer flies require a blood meal to develop eggs.
Deer flies require a blood meal to develop eggs.,Deer flies require deer flies require a blood meal to reproduce.
Oxygen gases sustain life.,Oxygen gases sustain cellular respiration.
Oxygen gases sustain life.,Oxygen gases sustain respiration.
Oxygen gases sustain life.,Oxygen gases sustain animal life.
Oxygen gases sustain life.,Oxygen gases sustain organisms.
Domestic pigs eat insects.,Domestic pigs eat crickets.
Domestic pigs eat insects.,Domestic pigs eat insects.
Domestic pigs eat insects.,Domestic pigs eat bugs.
Gerbils has-part tails.,Gerbils has a tail.
Sperm whales have eyes.,Sperm whales have a sight.
Cats have long thick fur.,"Cats have a longhaired cats have a coat of long, thick fur."
Cats have long thick fur.,"Cats have a long, thick fur."
Cats have long thick fur.,Cats have a thick fur.
Cats have long thick fur.,Cats have a long fur.
Dogs have teeth.,Dogs have sharp incisors for cutting meat.
Dogs have teeth.,Dogs have incisors.
Dogs have teeth.,Dogs have canine teeth.
Dogs have teeth.,Dogs have canines.
Dogs have teeth.,Dogs have molars.
Carnivorous bats have ears.,Carnivorous bats have ears on the side of their head.
Carnivorous bats have ears.,Carnivorous bats have an external ear.
Carnivorous bats have ears.,Carnivorous bats have external ears.
Carnivorous bats have ears.,Carnivorous bats have internal ears.
Elephants possess genes.,Elephants possess genes that are passed from parents to their offspring.
Beavers have front teeth.,Beavers have canines.
Antelopes live in safety.,Antelopes live in a natural safety.
Ermines have soft fur.,Ermines have the fur of the ermine is very soft.
Ermines have soft fur.,Ermines have a soft fur.
Ermines have soft fur.,Ermines have a fur.
Vertebrates have behavior.,Vertebrates have a gait.
Vertebrates have behavior.,Vertebrates have locomotion.
Vertebrates have behavior.,Vertebrates have a movement.
Caribou feeds on lichens.,A caribou feeds on lichens on the ground.
Caribou feeds on lichens.,A caribou feeds on lichens on rocks.
Bears have teeth.,Bears have canines.
Bears have teeth.,Bears have incisors.
Bears have teeth.,Bears have molars.
Foxes kill animals.,Foxes kill other small mammals.
Gray wolves eat prey.,Gray wolves eat small mammals.
Mice carry genes.,Mice carry alleles.
Badgers feed on insects.,Badgers feed on grubs.
Badgers feed on insects.,Badgers feed on insects.
Badgers feed on insects.,Badgers feed on flies.
Bottlenose dolphins inhabit temperate sea.,Bottlenose dolphins inhabit the temperate sea.
Frogs have bones.,Frogs have vertebrae bones.
Iberian lynxes eat european rabbits.,Iberian lynxes eat european rabbits.
Iberian lynxes eat european rabbits.,Iberian lynxes eat an european rabbit.
Arctic foxes have compact body shapes.,Arctic foxes have very streamlined bodies.
Monkeys carry babies.,Monkeys carry babies of other species.
Monkeys carry babies.,Monkeys carry orphaned infants.
Tree shrews have fluffy tails.,Tree shrews have a bushy tail.
Tree shrews have fluffy tails.,"Tree shrews have a tails covered in long, soft hair."
Tree shrews have fluffy tails.,Tree shrews have a lengthy tail.
Grizzly bears eat fish.,Grizzly bears eat fish.
Dolphins live in oceans.,Dolphins live in the open ocean.
Dolphins live in oceans.,Dolphins live in an open ocean.
Capybaras have scent glands.,Capybaras have glands on their flanks that secrete a smelly substance.
Deer live in mountains.,Deer live in mountainous regions.
Dolphins occur in water.,Dolphins occur in sea water.
Gorillas live in jungle.,Gorillas live in a tropical rainforest.
Ocelots eat animals.,Ocelots eat small mammals.
Elephants live in savanna.,Elephants live in a tropical savanna.
Elephants live in savanna.,Elephants live in a grassland savanna.
Elephants live in savanna.,Elephants live in an african savannah.
Elephants live in savanna.,Elephants live in an african savanna.
American foxhounds have noses.,American foxhounds have a nasal.
Bats spread wings.,Bats spread a wing shape.
Bats spread wings.,Bats spread a wingspan.
Bats spread wings.,Bats spread a wing configuration.
Bats spread wings.,Bats spread a wing area.
Bats spread wings.,Bats spread a wing morphology.
Arctic hares have eyesights.,Arctic hares have an ability to see color.
Arctic hares have eyesights.,Arctic hares have an extra high visual acuity.
Arctic hares have eyesights.,Arctic hares have normal eyesight.
Cattle live in habitats.,A Cattle live in a rangeland.
Fly squirrels eat pecans.,Fly squirrels eat pecans.
Monkeys have flexible arms.,Monkeys have forearms.
Manatees live in water.,Manatees live in salt water.
Ferrets eat food.,Ferrets eat a rodent.
Foxhounds have noses.,Foxhounds have a good nose for scent.
Foxhounds have noses.,Foxhounds have a good nose for tracking.
Foxhounds have noses.,Foxhounds have a good nose for game.
Dogs are descended from gray wolves.,Dogs are descended from gray wolves.
Platypuses adapt to water.,Platypuses adapt to fresh water.
Platypuses adapt to water.,Platypuses adapt to estuaries.
Infect bats leave hibernation sites.,Infect bats leave hibernacula are the places where bats hibernate.
Aardvarks have snouts.,"Aardvarks have a short, upturned snout."
Aardvarks have snouts.,Aardvarks have a sharply upturned snout.
Dandelions attract bees.,Dandelions attract bumblebees.
Dandelions attract bees.,Dandelions attract honeybees.
Dandelions attract bees.,Dandelions attract a honeybee.
Wolves have jaws.,Wolves have canines.
Wolves have jaws.,Wolves have the canines.
Gopher tortoises have temperature.,Gopher tortoises have an internal body temperature.
Gopher tortoises have temperature.,Gopher tortoises have a body temperature.
Fly squirrels use broad tails.,Fly squirrels use broad tails.
Jaguars have legs.,Jaguars have hind legs.
Jaguars have legs.,Jaguars have front legs.
Mice enter burrows.,Mice enter burrows in the soil.
Platypuses have intestines.,Platypuses have an intestinal tract.
Raccoons occupy habitats.,Raccoons occupy residential areas.
Raccoons use front paws.,Raccoons use dexterous front paws.
Raccoons use front paws.,Raccoons use forelimbs.
Raccoons use front paws.,Raccoons use paws.
Mice have thymus organs.,Mice have a thymus gland.
Mice have thymus organs.,Mice have thymic corpuscles.
Mice have thymus organs.,Mice have a mice have a thymus organ.
Dogs have four legs.,Dogs have dogs have 4 legs.
Dioxide affects photosynthesis.,A Dioxide affects photosynthesis in plants.
Carbohydrates find in fruit.,Carbohydrates find in fruits.
Frogs have feet.,Frogs have splayed feet.
Frogs have feet.,Frogs have a foot.
Frogs have feet.,Frogs have long toes.
Caterpillars live from about two weeks to a month.,Caterpillars live from about two weeks to a month.
Caterpillars live from about two weeks to a month.,Caterpillars live from a caterpillars live for about two weeks to a month.
Caterpillars live from about two weeks to a month.,Caterpillars live from a caterpillars can live up to a month.
Caterpillars live from about two weeks to a month.,Caterpillars live from they can live up to two months.
Shrews eat prey.,Shrews eat small mammals.
Shrews eat prey.,Shrews eat small rodents.
Dolphins feed in bays.,Dolphins feed in the bay.
Brown bears have senses.,Brown bears have a smell.
Brown bears have senses.,Brown bears have a sight.
Brown bears have senses.,Brown bears have hearing.
Kangaroos have long tails.,"Kangaroos have the hairy-tail has a long, bristly tail."
Frogs are known as amphibians.,Frogs are known as frogs are a type of amphibian.
Frogs are known as amphibians.,Frogs are known as frogs.
Mule deer have ears.,Mule deer have mule deer have long ears.
Mule deer have ears.,Mule deer have a fleshy ear lobe.
Shrews vary in size.,Shrews vary in head and body length.
Shrews vary in size.,Shrews vary in body size.
Jackrabbits occupy shrubs.,Jackrabbits occupy shrublands.
Salamanders have backs.,Salamanders have dorsal backs.
Bats live in trees.,Bats live in tree hollows.
Cheetahs have long legs.,Cheetahs have long legs.
Caterpillars feed on plants of some kind.,Caterpillars feed on a variety of plants.
Possums have fur.,Possums have a fur.
Possums have fur.,Possums have a hair.
Walruses use long tusks.,Walruses use tusks.
Vertebrates possess genes.,"Vertebrates possess chromosomes, dna, genes, alleles, genotypes, phenotypes."
Hamsters hide in burrows.,Hamsters hide in burrows in the ground.
Beavers eat bark.,Beavers eat bark.
Moose have long legs.,"Moose have large, muscular legs."
Salamanders reach maturity.,Salamanders reach a metamorphosis into their adult form.
Salamanders reach maturity.,"Salamanders reach sexual maturity, mature enough to breed, and physically mature."
Salamanders reach maturity.,Salamanders reach a maturational age.
Salamanders reach maturity.,Salamanders reach a physical maturity.
Salamanders reach maturity.,Salamanders reach an adult.
Salamanders reach maturity.,Salamanders reach physiological maturity.
Raccoons have sharp front teeth.,Raccoons have canines.
Raccoons have sharp front teeth.,Raccoons have sharp.
Armadillos have strong claws.,Armadillos have sharp claws.
Armadillos have strong claws.,Armadillos have long claws.
Cellular respiration produces carbon dioxide.,A cellular respiration produces a carbon dioxide gas.
Echidnas eat worms.,Echidnas eat earthworms.
Caribou feeds on terrestrial lichens.,A caribou feeds on lichens.
Otters live in waterways.,Otters live in estuaries.
Otters live in waterways.,Otters live in marine waters.
Otters live in waterways.,Otters live in rivers.
Otters live in waterways.,Otters live in streams.
Otters live in waterways.,Otters live in canals.
Spider monkeys have sexual reproduction.,Spider monkeys have male and female reproduction.
Spider monkeys have sexual reproduction.,Spider monkeys have a sexual reproduction.
Spider monkeys have sexual reproduction.,Spider monkeys have reproductive organs.
Human activities affect surface temperature.,Human activities affect surface temperature of the atmosphere.
Human activities affect surface temperature.,Human activities affect surface temperature of the earth.
Human activities affect surface temperature.,Human activities affect land surface temperature.
Human activities affect surface temperature.,Human activities affect surface temperature of the air.
Human activities affect surface temperature.,Human activities affect surface temperature of land.
Human activities affect surface temperature.,Human activities affect water surface temperature.
Arctic foxes have insulation.,"Arctic foxes have bodies covered in a thick, insulating coat of fur."
Catfish have caudal fins.,Catfish have a caudal fin.
Catfish have caudal fins.,Catfish have caudal fins.
Rabbits hide in grass.,Rabbits hide in a field.
Rabbits hide in grass.,Rabbits hide in grasses.
Cats adapt to habitats.,Cats adapt to the wild.
Rats have teeth.,Rats have incisors.
Rats have teeth.,Rats have molars.
Salamanders possess bodies.,Salamanders possess four limbs.
Respiration produces carbon dioxide.,A respiration produces a carbon dioxide gas.
Humans have teeth.,"Humans have incisors - sharp, front teeth for biting."
Humans have teeth.,Humans have incisors.
Humans have teeth.,Humans have molars.
Gerbils give birth to offspring.,Gerbils give an offspring.
Box jellyfish have long tentacles.,Box jellyfish have long sensory tentacles.
Common wombats have fur.,Common wombats have a fine fur.
Common wombats have fur.,Common wombats have a fur.
Baboons have sharp teeth.,Baboons have sharp incisors.
Baboons have sharp teeth.,Baboons have incisors.
Baboons have sharp teeth.,Baboons have sharp canines.
Baboons have sharp teeth.,Baboons have canines.
Baboons have sharp teeth.,Baboons have sharp molars.
Carbohydrates use for energy.,Carbohydrates use for production of heat.
Carbohydrates use for energy.,Carbohydrates use for heat.
Dioxide enters atmospheres.,A Dioxide enters atmospheres in which combustion occurs.
Cats have large intestines.,Cats have a large intestine.
Foxes have claws.,Foxes have claws on their paws.
Foxes have claws.,Foxes have sharp claws.
Spider monkeys have reproduction.,Spider monkeys have a sexual reproduction.
Tapeworms absorb nutrients.,Tapeworms absorb minerals.
Tapeworms absorb nutrients.,Tapeworms absorb vitamins.
Vertebrate herbivores are relatively general in diet.,Vertebrate herbivores are relatively general in a herbivore.
Colobus monkeys eat flower fruit.,Colobus monkeys eat flowers.
Polar bears adapt to heat.,Polar bears adapt to a body heat.
Fly squirrels eat insects.,Fly squirrels eat gnats.
Fly squirrels eat insects.,Fly squirrels eat beetles.
Fly squirrels eat insects.,Fly squirrels eat flies.
Fly squirrels eat insects.,Fly squirrels eat mosquitoes.
Deer depend on vegetation.,Deer depend on herbaceous plants provide food for deer.
Deer depend on vegetation.,Deer depend on shrubs.
Terrestrial salamanders are inactive during cold weather.,Terrestrial salamanders are inactive during cold winter weather.
Terrestrial salamanders are inactive during cold weather.,Terrestrial salamanders are inactive during winter.
Terrestrial salamanders are inactive during cold weather.,Terrestrial salamanders are inactive during ground temperatures below freezing.
Dogs have odor.,Dogs have the smell of a dog's feces.
Cats have sharp claws.,Cats have sharp claws on the front paws.
Cats have sharp claws.,Cats have razor-sharp claws.
Severe cataracts lead to blindness.,Severe cataracts lead to cataracts can lead to a decline in vision.
Severe cataracts lead to blindness.,Severe cataracts lead to cataracts can lead to a loss in vision.
Severe cataracts lead to blindness.,Severe cataracts lead to cataracts can lead to a deterioration in vision.
Severe cataracts lead to blindness.,Severe cataracts lead to cataracts can lead to blindness.
Severe cataracts lead to blindness.,Severe cataracts lead to blindness can be caused by cataracts.
Severe cataracts lead to blindness.,Severe cataracts lead to cataracts can lead to a condition called blindness.
Severe cataracts lead to blindness.,Severe cataracts lead to reduced vision.
Severe cataracts lead to blindness.,Severe cataracts lead to visual impairment.
Severe cataracts lead to blindness.,Severe cataracts lead to blindness.
Snakes depend on mice.,Snakes depend on mice that live in the wild.
Asparagus beetles feed on plants.,Asparagus beetles feed on an asparagus plant.
Crocodiles feed on sea fish.,Crocodiles feed on smaller species of fish.
Sea turtles roam oceans.,Sea turtles roam the open ocean.
Sea turtles roam oceans.,Sea turtles roam the atlantic ocean.
Sea turtles roam oceans.,Sea turtles roam atlantic.
Pit vipers have structures.,Pit vipers have a body.
Lizards possess nasal glands.,Lizards possess a nasolacrimal duct.
Lizards possess nasal glands.,Lizards possess a nasopalatine duct.
Lizards occur in deserts.,Lizards occur in semi-arid deserts.
Lizards occur in deserts.,Lizards occur in arid deserts.
Lizards occur in deserts.,Lizards occur in arid.
Lizards occur in deserts.,Lizards occur in dry deserts.
Crocodiles feed on fish.,Crocodiles feed on fish.
Snakes have mouths.,Snakes have a mouth.
Lizards walk on feet.,Lizards walk on lizards walk on their toes.
Lizards display color.,Lizards display a body color.
Lizards have offspring.,Lizards have lizards can have many offspring or just a few.
Lizards have offspring.,Lizards have lizards can have live young or lay eggs.
Desert lizards possess nasal salt glands.,Desert lizards possess nasal salt glands.
Snakes shed outer skin.,Snakes shed an epidermis.
Tortoises reach adulthood.,"Tortoises reach sexual maturity, maturity of shell, maturity of bones."
Tortoises reach adulthood.,Tortoises reach sexual maturity.
Tortoises reach adulthood.,Tortoises reach a mature size.
Tortoises reach adulthood.,Tortoises reach a physical maturity.
Tortoises reach adulthood.,Tortoises reach reproductive maturity.
Crocodiles eat prey.,Crocodiles eat fish.
Crocodiles eat prey.,Crocodiles eat insects.
Crocodiles eat prey.,Crocodiles eat birds.
Crocodiles eat prey.,Crocodiles eat mammals.
Sea turtles go into open water.,Sea turtles go into the ocean.
Snakes hide in sand.,Snakes hide in a sandy loam soil.
Snakes hide in sand.,Snakes hide in desert sand.
Snakes hide in sand.,Snakes hide in sand.
Geckos are oviparous.,Geckos are oviparous.
Geckos are oviparous.,Geckos are geckos are oviparous.
Lizards grow into adults.,Lizards grow into an adult lizards can be male or female.
